{
  "document_id": "DOC_a81f23bc",
  "source_type": "interim_report",
  "title": "意华股份2026年半年度报告",
  "issuer": "意华股份",
  "published_at": "2026-08-25",
  "retrieved_at": "2026-09-15T10:30:00+08:00",
  "url": "https://www.cninfo.com.cn/new/disclosure/002897",
  "local_path": "raw/2026H1.pdf",
  "sha256": "3b1f2c4d5e6f708192a3b4c5d6e7f8091a2b3c4d5e6f708192a3b4c5d6e7f809",
  "source_group": "CNINFO_002897_2026H1",
  "page_count": 168,
  "sections": ["主要会计数据", "主营业务分行业情况"]
}
